title,abstract,abstract_fr
"Urine complement-related proteins in IgA nephropathy and IgA vasculitis nephritis, possible biomarkers of disease activity.","The activation of the complement system plays an important role in the pathogenesis of IgA nephropathy (IgAN). Our primary aim was to evaluate a range of complement-related proteins, including pentraxin-3 (PTX-3), in blood and urine at diagnosis and their association with disease activity in the kidney biopsy, eGFR, albuminuria, and outcome. Our secondary aim was to compare the same biomarkers between patients with IgAN and IgA vasculitis with renal involvement (IgAVN). In a longitudinal Swedish cohort of 96 patients with IgAN ( Patients with detectable vs undetectable u-PTX-3 and u-mannose-binding lectin (MBL) more frequently had mesangial hypercellularity, endocapillary proliferation, and crescents in their kidney biopsy. u-C4c levels were higher in patients with advanced tubulointerstitial fibrosis, and u-C4c was also an independent predictor of a more severe eGFR slope. There were no differences in the levels of biomarkers between patients with IgAN and IgAVN. u-PTX-3 and u-MBL might be biomarkers of an active proliferative stage of the disease, while higher u-C4c levels indicate more chronic lesions in both IgAN and IgAVN. These results must, however, be confirmed in larger and multiethnic cohorts.","L'activation du système de complément joue un rôle important dans la pathogenèse de la néphropathie IgA (IGAN). Notre objectif principal était d'évaluer une gamme de protéines liées au complément, y compris la pentraxine-3 (PTX-3), dans le sang et l'urine au moment du diagnostic et leur association avec l'activité de la maladie dans la biopsie rénale, l'EGFR, l'albuminurie et les résultats. Notre objectif secondaire était de comparer les mêmes biomarqueurs entre les patients atteints de vascularite IgAN et IgA avec atteinte rénale (IGAVN). Dans une cohorte suédoise longitudinale de 96 patients atteints d'IgAN (patients atteints de lectine de liaison (MBL) détectable et non détectable, a eu plus fréquemment une hypercellularité mésangiale, une prolifération endocapillaire et des croissants dans leur biopsie rein. Les niveaux étaient plus élevés chez les patients atteints de fibrose tubulo-interstitielle avancée et U-C4C était également un prédicteur indépendant d'une pente EGFR plus sévère. Des niveaux U-C4C plus élevés indiquent des lésions plus chroniques dans IGAN et IGAVN. cohortes."
Renal function and clinical outcomes in survivors of out-of-hospital cardiac arrest.,"Comprehensive studies about renal-function changes in the context of out-of-hospital cardiac arrest (OHCA) have been lacking. Therefore, we investigated the impact of renal function on clinical outcomes among patients with OHCA. This retrospective cohort study enrolled consecutive patients with OHCA between June 2017 and December 2021. Acute kidney injury (AKI) was defined based on the ""Kidney Disease: Improving Global Outcomes (KDIGO)"" guidelines. AKI recovery was defined as a decrease in serum creatinine below the level determined in the definition of AKI. Clinical outcomes included neurological outcomes and all-cause mortality. A total of 258 patients were enrolled, including 35 patients with underlying end-stage renal disease (ESRD). Among patients without ESRD, 82.5% developed AKI, of which 31.0% achieved AKI recovery, while 61.0% were discharged with impaired renal function. Multivariable analysis using regression models revealed that unfavorable neurological outcomes at discharge and higher mortality at 2 years were associated with AKI (odds ratio [OR] 7.684, 95% confidence interval (CI) 2.683-22.010,  AKI, AKI without recovery, and impaired pre-discharge renal function were significantly correlated with worse clinical outcomes in OHCA among patients without ESRD, while underlying ESRD did not lead to worse clinical outcomes.","Des études complètes sur les changements de fonction rénale dans le contexte de l'arrêt cardiaque hors hospitalier (OHCA) ont fait défaut. Par conséquent, nous avons étudié l'impact de la fonction rénale sur les résultats cliniques chez les patients atteints d'OHCA. Cette étude de cohorte rétrospective a inscrit des patients consécutifs avec l'OHCA entre juin 2017 et décembre 2021. Une lésion rénale aiguë (AKI) a été définie sur la base des directives de la ""maladie rénale: amélioration des résultats mondiaux (KDIGO)"". La récupération de l'AKI a été définie comme une diminution de la créatinine sérique en dessous du niveau déterminé dans la définition d'AKI. Les résultats cliniques comprenaient les résultats neurologiques et la mortalité toutes causes. Au total, 258 patients ont été inscrits, dont 35 patients atteints d'une maladie rénale sous-jacente (ESRD). Parmi les patients sans ESRD, 82,5% ont développé AKI, dont 31,0% ont obtenu une récupération d'AKI, tandis que 61,0% ont été libérés avec une fonction rénale altérée. Une analyse multivariable utilisant des modèles de régression a révélé que les résultats neurologiques défavorables à la décharge et une mortalité plus élevée à 2 ans étaient associés à l'AKI (Ratio de cotes [OR] 7,684, intervalle de confiance à 95% (IC) 2,683-22.010, AKI, AKI sans récupération, et altéré pré-pré -Les fonctions de la fonction rénale étaient significativement corrélées avec des résultats cliniques pires dans l'OHCA chez les patients sans ESRD, tout en sous-jacent à l'ESRD n'a pas conduit à des résultats cliniques pires."
Association between geriatric nutritional risk index and overactive bladder in the elderly population: a cross-sectional study.,"The prevalence of overactive bladder (OAB) is increasing in the elderly population and there is growing evidence that malnutrition affects the urinary system. Despite this, research on the relationship between nutritional factors and OAB remains limited. We included 17,161 elderly individuals from the National Health and Nutrition Examination Survey conducted between 2005 and 2018. Overactive Bladder Symptom Scores (OABSS) were utilized to assess symptoms of OAB. A multifactorial logistic regression analysis was employed to evaluate the independent association between the Geriatric Nutritional Risk Index (GNRI) and the prevalence of OAB. Restricted cubic spline plots examined the potential non-linear relationship between GNRI and OAB. Influencing factors were assessed through subgroup analyses, while the predictive utility of GNRI was assessed with receiver operating characteristic (ROC) curves. The influence of inflammatory response and cognitive function on the interaction between GNRI and OAB was also examined by mediation analysis. GNRI in the OAB group was significantly lower than that in the non-OAB group. Multifactorial logistic regression analysis revealed that GNRI significantly predicts OAB ( GNRI serves as a reliable predictive marker for OAB in the elderly population, demonstrating a nonlinear inverse correlation with OAB prevalence. Furthermore, this study elucidates the underlying inflammatory mechanisms that link GNRI to the development of OAB.","La prévalence de la vessie hyperactive (OAB) augmente dans la population âgée et il existe de plus en plus de preuves que la malnutrition affecte le système urinaire. Malgré cela, la recherche sur la relation entre les facteurs nutritionnels et l'OAB reste limitée. Nous avons inclus 17 161 personnes âgées des personnes âgées de l'enquête nationale sur les examens de santé et de nutrition menée entre 2005 et 2018. Les scores de symptômes de la vessie hyperactifs (OABSS) ont été utilisés pour évaluer les symptômes de l'OAB. Une analyse de régression logistique multifactorielle a été utilisée pour évaluer l'association indépendante entre l'indice de risque nutritionnel gériatrique (GNRI) et la prévalence de l'OAB. Les parcelles splines cubiques restreintes ont examiné la relation non linéaire potentielle entre GNRI et OAB. Les facteurs d'influence ont été évalués par des analyses de sous-groupes, tandis que l'utilité prédictive des GNRI a été évaluée avec des courbes caractéristiques de fonctionnement du récepteur (ROC). L'influence de la réponse inflammatoire et de la fonction cognitive sur l'interaction entre GNRI et OAB a également été examinée par analyse de médiation. GNRI dans le groupe OAB était significativement inférieur à celui du groupe non OAB. L'analyse de régression logistique multifactorielle a révélé que GNRI prédit de manière significative l'OAB (GNRI sert de marqueur prédictif fiable pour l'OAB dans la population âgée, démontrant une corrélation inverse non linéaire avec la prévalence de l'OAB. OAB."
The Diminished Cardiorespiratory Fitness in Cardiovascular-Kidney-Metabolic Syndrome.,"The American Heart Association has recently emphasized the significance of the cardiovascular-kidney-metabolic (CKM) syndrome. However, the cumulative impact of these factors on cardiorespiratory fitness remains inadequately characterized. This study aimed to examine the responses observed during cardiopulmonary exercise testing (CPET) of CKM syndrome patients and explore the potential correlation between cardiorespiratory fitness and hemoglobin concentration in this cohort. Cross-sectional study. We retrospectively collected medical data of 8206 patients who underwent CPET from 2012-2022. Among the 878 individuals enrolled, 12 were healthy controls, 809 had isolated CVD, and 57 were in CKM stage 4. After propensity score matching, 112 patients were included in the matched cohort analysis, with 56 each in the CVD and CKM groups. CPET responses were compared between the groups using propensity matched analysis. Additionally, simple mediation models were employed to investigate the potential mediating role of hemoglobin concentration in the association between CKM syndrome and peak VO After propensity score-matching, CKM stage 4 was associated with diminished cardiorespiratory fitness compared to the other two groups. This included diminished exercise capacity, reflected by shorter exercise time, lower maximum workload (and its percent predicted value), and reduced peak VO2 (including its percent predicted value and peak VO2/kg). Additionally, cardiac autonomic function was impaired, as evidenced by decreased heart rate recovery (HRR) and a reduced slope of HR recovery (all  Individuals with CKM syndrome demonstrate compromised responses to CPET manifested by diminished exercise capacity and cardiac autonomic function. While diminished peak oxygen uptake can be partly explained by hemoglobin concentration as we found, further research is necessary to understand other underlying mechanisms.","L'American Heart Association a récemment souligné l'importance du syndrome cardiovasculaire-kidney-métabolique (CKM). Cependant, l'impact cumulatif de ces facteurs sur la forme cardiorespiratoire reste insuffisamment caractérisé. Cette étude visait à examiner les réponses observées lors des tests d'exercice cardiopulmonaire (CEPT) des patients atteints du syndrome de CKM et à explorer la corrélation potentielle entre la forme cardiorespiratoire et la concentration d'hémoglobine dans cette cohorte. Étude transversale. Nous avons collecté rétrospectivement les données médicales de 8206 patients qui ont subi un CEPT de 2012 à 2022. Parmi les 878 individus inscrits, 12 étaient des témoins sains, 809 avaient des MCV isolés et 57 étaient au stade CKM 4. Après l'appariement du score de propension, 112 patients ont été inclus dans l'analyse de cohorte appariée, avec 56 chacun dans les groupes CVD et CKM. Les réponses CEPT ont été comparées entre les groupes en utilisant une analyse appariée à la propension. De plus, de simples modèles de médiation ont été utilisés pour étudier le rôle potentiel de médiation de la concentration d'hémoglobine dans l'association entre le syndrome de CKM et la VO maximale après la correspondance du score de propension, le stade 4 de CKM a été associé à une diminution de la condition cardiorespiratoire par rapport aux deux autres groupes. Cela comprenait une diminution de la capacité d'exercice, reflétée par un temps d'exercice plus court, une charge de travail maximale plus faible (et sa valeur en pourcentage prédite) et une réduction de la VO2 maximale (y compris sa valeur prévue en pourcentage et sa VO2 / kg maximale). De plus, la fonction autonomique cardiaque a été altérée, comme en témoigne la diminution de la récupération de la fréquence cardiaque (RRR) et une pente réduite de récupération des RH (toutes les personnes atteintes du syndrome de CKM démontrent des réponses compromises à CPE L'absorption peut s'expliquer en partie par la concentration d'hémoglobine comme nous l'avons constaté, des recherches supplémentaires sont nécessaires pour comprendre d'autres sous-jacents mécanismes."
A pilot randomized controlled study of integrated kidney palliative care and chronic kidney disease care implemented in a safety-net hospital: Protocol for a pilot study of feasibility of a randomized controlled trial.,"Chronic kidney disease (CKD) impacts more than 800 million people. It causes significant suffering and disproportionately impacts marginalized populations in the United States. Kidney palliative care has the potential to alleviate this distress, but has not been tested. This pilot study evaluates the feasibility of a randomized clinical trial (RCT) testing the efficacy of integrated kidney palliative and CKD care in an urban safety-net hospital. This is a single-site pilot RCT designed to enroll 85 participants, with a goal of at least 60 completing the study. The inclusion criteria are adults 18 or older, who are either Spanish or English speakers, have an estimated Glomerular Filtration Rate (eGFR) of ≤30 mL/min/1.73 m This pilot RCT will provide essential data on the feasibility of testing integrated palliative care in CKD care in an underserved setting. These outcomes will inform a larger, fully powered trial that tests the efficacy of our kidney palliative care approach. NCT04998110.","La maladie rénale chronique (CKD) a un impact sur plus de 800 millions de personnes. Il provoque une souffrance importante et un impact de manière disproportionnée des populations marginalisées aux États-Unis. Les soins palliatifs rénaux ont le potentiel de soulager cette détresse, mais n'ont pas été testés. Cette étude pilote évalue la faisabilité d'un essai clinique randomisé (ECR) testant l'efficacité des soins palliatifs rénaux et des CKD intégrés dans un hôpital urbain de sécurité de sécurité. Il s'agit d'un ECR pilote à site unique conçu pour inscrire 85 participants, avec un objectif d'au moins 60 terminant l'étude. Les critères d'inclusion sont des adultes de 18 ans ou plus, qui sont des sous-orateurs espagnols ou anglais, ont un taux de filtration glomérulaire estimé (EGFR) de ≤ 30 ml / min / 1,73 m Ce Pilot RCT fournira des données essentielles sur la faisabilité du test des soins palliatifs intégrés dans CKD Care dans un cadre mal desservi. Ces résultats éclaireront un essai plus grand et entièrement alimenté qui teste l'efficacité de notre approche de soins palliatifs rénaux. NCT04998110."
"The ERA Registry Annual Report 2022: Epidemiology of Kidney Replacement Therapy in Europe, with a focus on sex comparisons.","The European Renal Association (ERA) Registry collects data on kidney replacement therapy (KRT) in patients with end-stage kidney disease (ESKD). This paper summarizes the ERA Registry Annual Report 2022, with a special focus on comparisons by sex. The supplement of this paper contains the complete ERA Registry Annual Report 2022. Data was collected from 53 national and regional KRT registries from 35 countries. Using this data, incidence, and prevalence of KRT, kidney transplantation rates, survival probabilities, and expected remaining lifetimes were calculated. In 2022, 530 million people of the European general population were covered by the ERA Registry. The incidence of KRT was 152 per million population (pmp). In incident patients, 54% were 65 years or older, 64% were male, and the most common primary renal disease (PRD) was diabetes mellitus (22%). At KRT initiation, 83% of patients received haemodialysis, 12% received peritoneal dialysis, and 5% underwent pre-emptive kidney transplantation. On 31 December 2022, the prevalence of KRT was 1074 pmp. In prevalent patients, 48% were 65 years or older, 62% were male, the most common PRD was of miscellaneous origin (18%), 56% of patients received haemodialysis, 5% received peritoneal dialysis, and 39% were living with a functioning graft. In 2022, the kidney transplantation rate was 40 pmp, with most kidneys coming from deceased donors (66%). For patients starting KRT between 2013 to 2017, 5-year survival probability was 52%. Compared with the general population, the expected remaining lifetime was 66% and 68% shorter for males and females, respectively, receiving dialysis, and 46% and 49% shorter for males and females, respectively, living with a functioning graft.","Le registre de la European Renal Association (ERA) recueille des données sur la thérapie rénale de remplacement rénal (KRT) chez les patients atteints d'une maladie rénale en phase terminale (ESKD). Cet article résume le rapport annuel du registre de l'ERA 2022, avec un accent particulier sur les comparaisons par sexe. Le supplément de ce document contient le rapport annuel complet du registre de l'ERA 2022. Les données ont été collectées auprès de 53 registres nationaux et régionaux de la KRT de 35 pays. À l'aide de ces données, de l'incidence et de la prévalence de KRT, des taux de transplantation rénale, des probabilités de survie et des durées de vie attendues ont été calculées. En 2022, 530 millions de personnes de la population générale européenne ont été couvertes par le registre des ERA. L'incidence de KRT était de 152 par million d'habitants (PMP). Chez les patients incidents, 54% étaient de 65 ans ou plus, 64% étaient des hommes et la maladie rénale primaire la plus courante (PRD) était le diabète sucré (22%). À l'initiation de KRT, 83% des patients ont reçu une hémodialyse, 12% ont reçu une dialyse péritonéale et 5% ont subi une transplantation rénale préventive. Le 31 décembre 2022, la prévalence du KRT était à 1074 PMP. Chez les patients répandus, 48% étaient de 65 ans ou plus, 62% étaient des hommes, le PRD le plus courant était d'origine diverse (18%), 56% des patients ont reçu une hémodialyse, 5% ont reçu une dialyse péritonéale et 39% vivaient avec un greffe fonctionnelle. En 2022, le taux de transplantation rénale était de 40 PMP, la plupart des reins provenant de donneurs décédés (66%). Pour les patients qui commencent le KRT entre 2013 et 2017, la probabilité de survie à 5 ans était de 52%. Par rapport à la population générale, la durée de vie restante attendue était de 66% et 68% plus courte pour les hommes et les femmes, respectivement, recevant une dialyse, et 46% et 49% plus courte pour les hommes et les femmes, respectivement, vivant avec une greffe fonctionnelle."
Transplant candidacy and unscheduled emergent surgery-a neglected aspect in prescribing direct oral anticoagulants in patients receiving dialysis.,,
Behind the Healing: Exploring the Psychological Battles of Kidney Transplant Patients: A Qualitative Insight.,"Kidney transplantation is widely regarded as the optimal treatment for end-stage renal disease, offering benefits like prolonged life expectancy, enhanced quality of life, and greater cost-effectiveness compared to dialysis. While dialysis imposes considerable restrictions on patients, including diminished independence, many of these challenges can be alleviated through successful transplantation. However, despite the physical advantages of kidney transplants, the psychological struggles faced by transplant recipients are often overlooked, particularly in Ethiopia. This study aimed to delve into the psychological experiences of kidney transplant patients, shedding light on the emotional and mental battles they encounter post-transplant. This qualitative study involved kidney transplant patients at SPMMC (St. Paul's Millennium Medical College). during the study period, regardless of donor type. A total of ten participants were selected using purposive sampling. Data were collected through semi-structured, interviewer-administered questionnaires containing both closed and open-ended questions. The data were transcribed verbatim and analyzed using interpretative phenomenological analysis (IPA). The analysis focused on understanding participants' experiences and their interpretations of these experiences. Themes were identified by examining commonalities and differences in the participants' accounts, with special attention to areas of convergence and divergence. The analysis revealed both positive and negative psychological experiences among kidney transplant patients. Positive experiences included feelings of ""re-birth,"" thankfulness, strengthened social bonds, freedom from dialysis, enhanced self-efficacy, and increased social support. Negative experiences included dependency, fear of the future, challenges with adherence to treatment, and occasional regret. Life after a kidney transplant is significantly more positive and empowering compared to life on dialysis. However, psychological challenges remain, highlighting the need for ongoing psychological support to address both positive and negative aspects of the transplant experience. Future research should focus on providing continuous support, including counseling and support groups, and integrating these systems into kidney transplant care to enhance overall recovery.","La transplantation rénale est largement considérée comme le traitement optimal pour les maladies rénales terminales, offrant des avantages tels que l'espérance de vie prolongée, une qualité de vie accrue et une plus grande rentabilité par rapport à la dialyse. Bien que la dialyse impose des restrictions considérables aux patients, notamment une diminution de l'indépendance, bon nombre de ces défis peuvent être atténués par une transplantation réussie. Cependant, malgré les avantages physiques des transplantations rénales, les difficultés psychologiques auxquelles sont confrontées les transplantations sont souvent négligées, en particulier en Éthiopie. Cette étude visait à se plonger dans les expériences psychologiques des patients atteints de transplantation rénale, mettant en lumière les batailles émotionnelles et mentales qu'ils rencontrent après la transplantation. Cette étude qualitative impliquait des patients atteints de transplantation rénale du SPMMC (St. Paul's Millennium Medical College). Pendant la période d'étude, quel que soit le type de donneur. Au total, dix participants ont été sélectionnés en utilisant un échantillonnage à dessein. Les données ont été collectées par le biais de questionnaires semi-structurés et administrés par l'intervieweur contenant des questions fermées et ouvertes. Les données ont été transcrites textuellement et analysées en utilisant l'analyse phénoménologique interprétative (IPA). L'analyse s'est concentrée sur la compréhension des expériences des participants et leurs interprétations de ces expériences. Les thèmes ont été identifiés en examinant les points communs et les différences dans les comptes des participants, avec une attention particulière aux domaines de convergence et de divergence. L'analyse a révélé des expériences psychologiques positives et négatives chez les patients atteints de transplantation rénale. Les expériences positives comprenaient des sentiments de «renaissance», de reconnaissance, de liens sociaux renforcés, de liberté de dialyse, d'auto-efficacité accrue et de soutien social accru. Les expériences négatives comprenaient la dépendance, la peur de l'avenir, les défis avec l'adhésion au traitement et les regrets occasionnels. La vie après une greffe de rein est significativement plus positive et stimulante par rapport à la vie sur la dialyse. Cependant, des défis psychologiques demeurent, soulignant la nécessité d'un soutien psychologique continu pour remédier aux aspects positifs et négatifs de l'expérience de transplantation. Les recherches futures devraient se concentrer sur la fourniture d'un soutien continu, y compris des groupes de conseil et de soutien, et l'intégration de ces systèmes dans des soins de transplantation rénale pour améliorer la récupération globale."
