title,abstract,abstract_fr
The clinical characteristics and implications of acute kidney injury during induction therapy for acute promyelocytic leukemia.,"Dual induction with all-trans retinoic acid (ATRA) and arsenic trioxide (ATO) has made acute promyelocytic leukemia (APL) a curable disease. However, differentiation syndrome (DS) can be a life-threatening complication of induction therapy. It is considered to result from a severe systemic inflammatory response mediated by increased expression of cytokines, chemokines, and adhesion molecules on differentiating blast cells. The kidney, as a vital organ rich in the capillary endothelium, could be targeted by differentiating blasts in DS. Acute kidney injury (AKI) is a rare but severe consequence of DS secondary to ATRA and ATO induction and can result in renal failure and early mortality. Nevertheless, its clinical characteristics and impact on APL prognosis have yet to be elucidated. The aim of this study was to describe the clinical characteristics of DS-related AKI in patients with APL and its impact on patient prognosis. This was a retrospective study from a single center in a real-world setting. APL patients who developed AKI during ATRA- and ATO-based induction were included. The patients' clinical/laboratory data and outcome information were retrieved from the electronic medical records. From January 2011 to March 2024, a total of 26 out of 572 (4.5%) APL patients were identified as having AKI during dual induction. Among them, eight patients received continuous renal replacement therapy, and 3/8 patients experienced early death (ED), which was defined as death within 3 months of diagnosis. Among the five non-ED patients, three did not recover from renal function and were still dialysis-dependent during the follow-up. The estimated 2-year overall survival rate for all patients was 42%, and the ED rate was 30.8%. Survival analysis revealed that a greater tumor burden, a rapidly increasing WBC count, worse coagulation parameters, and persistent renal dysfunction were associated with a more adverse prognosis. AKI is a rare but severe complication of DS in the ATRA + ATO dual-induction era of APL. It is associated with a high ED rate and dismal long-term survival. Some patients develop irreversible renal dysfunction and become dialysis-dependent after leukemia remission. Thus, the management of AKI in APL patients is still a clinical challenge, and a deeper understanding of its pathogenesis, along with multidisciplinary efforts, is needed.","La double induction avec de l'acide rétinoïque entièrement trans (ATRA) et du trioxyde d'arsenic (ATO) a fait de la leucémie promyélocytaire aiguë (APL) une maladie curable. Cependant, le syndrome de différenciation (DS) peut être une complication mortelle du traitement à l'induction. Il est considéré comme résultant d'une grave réponse inflammatoire systémique médiée par une expression accrue des cytokines, des chimiokines et des molécules d'adhésion sur la différenciation des cellules de souffle. Le rein, en tant qu'organe vital riche dans l'endothélium capillaire, pourrait être ciblé en différenciant les explosions dans DS. Les lésions rénales aiguës (AKI) sont une conséquence rare mais grave du DS secondaire à l'induction de l'ATRA et de l'ATO et peuvent entraîner une insuffisance rénale et une mortalité précoce. Néanmoins, ses caractéristiques cliniques et son impact sur le pronostic APL n'ont pas encore été élucidés. Le but de cette étude était de décrire les caractéristiques cliniques de l'AKI liée au DS chez les patients atteints d'APL et son impact sur le pronostic des patients. Il s'agissait d'une étude rétrospective d'un seul centre dans un cadre réel. Les patients APL qui ont développé AKI pendant l'induction à base d'ATRA et ATO ont été inclus. Les données cliniques / laboratoires des patients et les informations sur les résultats ont été récupérées des dossiers médicaux électroniques. De janvier 2011 à mars 2024, un total de 26 sur 572 (4,5%) patients APL a été identifié comme ayant un AKI pendant la double induction. Parmi eux, huit patients ont reçu un traitement de remplacement rénal continu et 3/8 patients ont connu des décès précoces (ED), qui ont été définis comme la mort dans les 3 mois suivant le diagnostic. Parmi les cinq patients non ED, trois ne se sont pas remis de la fonction rénale et étaient toujours dépendants de la dialyse pendant le suivi. Le taux de survie global estimé à 2 ans pour tous les patients était de 42% et le taux d'urgence était de 30,8%. L'analyse de survie a révélé qu'une charge tumorale plus élevée, un nombre de WBC augmentée rapidement, des paramètres de coagulation pire et une dysfonction rénale persistante étaient associés à un pronostic plus défavorable. L'AKI est une complication rare mais sévère de DS dans l'ère ATRA + ATO à double induction de l'APL. Il est associé à un taux d'urgence élevé et à une survie à long terme lamentable à long terme. Certains patients développent une dysfonction rénale irréversible et deviennent dépendants de la dialyse après la rémission de leucémie. Ainsi, la gestion de l'AKI chez les patients APL est toujours un défi clinique, et une compréhension plus approfondie de sa pathogenèse, ainsi que des efforts multidisciplinaires, est nécessaire."
Cardiac complications of arteriovenous access: a narrative review from a multidisciplinary team perspective.,"Although cardiovascular disease is common among hemodialysis patients, arteriovenous access creation has been invariably implicated in the evolution of adverse cardiac outcomes or deterioration of pre-existing cardiovascular disease. In most cases, these effects are subclinical but with potential underlying echocardiographic findings. Compared with grafts, arteriovenous fistulas are implicated more often, due to the progressively increased flow from the continuous dilatation of the venous outflow tract in the long term. The increasing flow is in the majority of patients well tolerated by cardiac adaptive alterations. However, the clinical impact is based on the balance between the amount of flow volume and the patient's cardiac reserves. Having extensively reviewed the existing English literature, we present the pathophysiology and the different types of cardiovascular complications, the indications, types, and efficacy of flow-restrictive procedures in the context of a high-flow AVF, as well as some precautions and considerations for AVF creation in high-risk patients.","Bien que les maladies cardiovasculaires soient courantes chez les patients hémodialysés, la création d'accès artérioveineux a été invariablement impliqué dans l'évolution des résultats cardiaques indésirables ou la détérioration des maladies cardiovasculaires préexistantes. Dans la plupart des cas, ces effets sont subcliniques mais avec des résultats échocardiographiques sous-jacents potentiels. Par rapport aux greffes, les fistules artérioveineuses sont impliquées plus souvent, en raison de l'écoulement progressivement accru de la dilatation continue du tractus d'écoulement veineux à long terme. L'augmentation du flux est dans la majorité des patients bien tolérés par des altérations adaptatives cardiaques. Cependant, l'impact clinique est basé sur l'équilibre entre la quantité de volume de débit et les réserves cardiaques du patient. Ayant examiné de manière approfondie la littérature anglaise existante, nous présentons la physiopathologie et les différents types de complications cardiovasculaires, les indications, les types et l'efficacité des procédures de limite de flux dans le contexte d'un AVF à haut débit, ainsi que des précautions et des considérations pour Création AVF chez les patients à haut risque."
Chronic Kidney Disease With Related Oral Health Problems and Alterations in the Tongue Microbiome Illustrated by a 15-Year-Old Girl: A Case Report.,"Chronic kidney disease (CKD) is characterised by a gradual loss of kidney function over time and is often linked to oral health issues. This case illustrates typical conditions in young CKD patients based on a 15-year-old girl with CKD stage 4 and methylmalonic aciduria, severe gingivitis and hyperplasia of the gingiva, and a need for orthodontic treatment. Oral hygiene interventions, homecare instructions and deep cleaning under antibiotic shielding were necessary to improve the patient's oral health. The immediate worsening of oral health status after extending the interval between regular prophylaxis appointments highlights the need for intensive prevention in young CKD patients to control oral health disorders. This report aims to demonstrate burden-of-care-reducing oral prophylaxis options for patients suffering from severe CKD with oral manifestations. ","La maladie rénale chronique (CKD) se caractérise par une perte progressive de fonction rénale au fil du temps et est souvent liée à des problèmes de santé bucco-dentaire. Ce cas illustre des conditions typiques chez les jeunes patients atteints de MCK sur la base d'une fillette de 15 ans atteinte de stade 4 et acidurie méthylmalonique, de gingivite sévère et d'hyperplasie de la gingiva, et un besoin de traitement orthodontique. Des interventions d'hygiène orale, des instructions à domicile et un nettoyage en profondeur sous blindage antibiotique étaient nécessaires pour améliorer la santé bucco-dentaire du patient. L'aggravation immédiate de l'état de santé bucco-dentaire après avoir prolongé l'intervalle entre les rendez-vous réguliers de prophylaxie met en évidence la nécessité d'une prévention intensive chez les jeunes patients atteints de CKD pour contrôler les troubles de la santé bucco-dentaire. Ce rapport vise à démontrer les options de prophylaxie orale réalisant la charge de la charge pour les patients souffrant d'une CKD sévère avec des manifestations orales."
Association between non-high-density lipoprotein cholesterol-to-high-density lipoprotein cholesterol ratio and macroalbuminuria: evidence from NHANES 1999-2018.,"The non-high-density lipoprotein cholesterol to high-density lipoprotein cholesterol ratio (NHHR) is a crucial lipid marker associated with various cardiovascular diseases. However, its relationship with kidney injury, particularly albuminuria, remains poorly understood. This study aims to investigate the association between NHHR and macroalbuminuria in U.S. adults. This cross-sectional study utilized data from the 1999-2018 National Health and Nutrition Examination Survey (NHANES). NHHR was calculated as (Total cholesterol - HDL cholesterol)/HDL cholesterol. Macroalbuminuria was defined by an albumin-creatinine ratio (ACR) >300 mg/g. Logistic regression, smoothed curve fitting, subgroup analyses, and sensitivity analysis were employed to assess the relationship between NHHR and macroalbuminuria. A total of 41,225 participants were included in the analysis. Higher NHHR was significantly associated with an increased likelihood of macroalbuminuria (OR = 1.34, 95% CI: 1.13-1.59, p=0.0007). Subgroup analysis revealed a stronger association in participants with BMI ≥30 kg/m In U.S. adults, an increased likelihood of incident NHHR levels of macroalbuminuria is positively associated and is more pronounced in those with a BMI ≥30kg/m","Le rapport cholestérol aux lipoprotéines non densité non densité (Cholestérol des lipoprotéines à haute densité (NHHR) est un marqueur lipidique crucial associé à diverses maladies cardiovasculaires. Cependant, sa relation avec les lésions rénales, en particulier l'albuminurie, reste mal comprise. Cette étude vise à étudier l'association entre le NHHR et la macroalbuminurie chez les adultes américains. Cette étude transversale a utilisé des données de l'Enquête nationale sur les examens de santé et de nutrition de 1999-2018 (NHANES). Le NHHR a été calculé comme (cholestérol total - cholestérol HDL) / cholestérol HDL. La macroalbuminurie a été définie par un rapport albumine-créatinine (ACR)> 300 mg / g. La régression logistique, l'ajustement de la courbe lissé, les analyses de sous-groupes et l'analyse de sensibilité ont été utilisés pour évaluer la relation entre le NHHR et la macroalbuminurie. Au total, 41 225 participants ont été inclus dans l'analyse. Un NHHR plus élevé était significativement associé à une probabilité accrue de macroalbuminurie (OR = 1,34, IC à 95%: 1,13-1,59, p = 0,0007). L'analyse des sous-groupes a révélé une association plus forte chez les participants avec un IMC ≥ 30 kg / m chez les adultes américains, une probabilité accrue de niveaux de NHHR incidents de macroalbuminurie est associé positivement et est plus prononcé chez ceux avec un IMC ≥30 kg / m"
Nonlinear association between glycated hemoglobin levels and mortality in elderly patients with non-diabetic chronic kidney disease: a national health and nutrition examination survey analysis.,"The relationship between glycated hemoglobin (HbA1c) levels and mortality outcomes in elderly patients with non-diabetic chronic kidney disease (CKD) has not been well characterized. This study aimed to investigate the correlation between HbA1c levels and all-cause and cardiovascular disease (CVD) mortality in elderly individuals with non-diabetic CKD. Data from the NHANES (1999-2018) were analyzed to measure HbA1c levels in whole blood using high-performance liquid chromatography (HPLC). Information on deaths and subsequent details was collected through the National Mortality Index until December 31, 2019. Hazard ratios (HR) and 95% confidence intervals (CIs) for all-cause and CVD mortality were calculated using weighted Cox proportional hazards and restricted cubic spline models. Among the 1,931 participants (mean [SE] age, 73.2 [0.2] years; 61.9% female), over a median follow-up period of 7.6 years, a total of 1,003 deaths were observed, including 412 from CVD. HbA1c was divided into four quartiles: Quartile 1 (3.7-5.3%), Quartile 2 (5.4-5.6%), Quartile 3 (5.7-5.8%) as the reference group, and Quartile 4 (5.9-6.4%). Higher risks of all-cause mortality were noted in the lowest and highest HbA1c quartiles, with adjusted HR (95% CI) of 1.48 (1.18-1.87) and 1.31 (1.01-1.70) respectively. For CVD mortality, the lowest quartile showed a significantly increased risk (HR 1.94, 95% CI: 1.29-2.90), but the highest quartile did not significantly differ from the reference, with HR 1.14 (0.73-1.77). The RCS analysis indicated a U-shaped nonlinear relationship between HbA1c levels and all-cause mortality (P = 0.026 for nonlinearity) and a J-shaped nonlinear relationship with CVD mortality (P = 0.035 for nonlinearity). This cohort study suggests that both low and high HbA1c levels are associated with an increased risk of all-cause mortality in elderly patients with non-diabetic CKD.","La relation entre les niveaux d'hémoglobine glyquée (HbA1c) et les résultats de mortalité chez les patients âgés atteints d'une maladie rénale chronique non diabétique (CKD) n'a pas été bien caractérisée. Cette étude visait à étudier la corrélation entre les niveaux d'HbA1c et la mortalité toutes causes et cardiovasculaires (MCV) chez les personnes âgées atteints de l'IRC non diabétique. Les données du NHANES (1999-2018) ont été analysées pour mesurer les niveaux d'HbA1c dans le sang total en utilisant une chromatographie liquide à haute performance (HPLC). Les informations sur les décès et les détails ultérieurs ont été collectées via l'indice national de mortalité jusqu'au 31 décembre 2019. Les ratios de risque (RH) et les intervalles de confiance à 95% (CIS) pour la mortalité toutes causes et CVD ont été calculés en utilisant des risques proportionnels pondérés COX et des spline cubique restreinte modèles. Parmi les 1 931 participants (âge moyen [SE], 73,2 [0,2] ans; 61,9% de femmes), sur une période de suivi médiane de 7,6 ans, un total de 1 003 décès ont été observés, dont 412 à partir de CVD. L'HbA1c a été divisée en quatre quartiles: quartile 1 (3,7-5,3%), quartile 2 (5,4-5,6%), quartile 3 (5,7-5,8%) comme groupe de référence et quartile 4 (5,9-6,4%). Des risques plus élevés de mortalité toutes causes ont été notés dans les quartiles HbA1c les plus bas et les plus élevés, avec HR ajusté (IC à 95%) de 1,48 (1,18-1,87) et 1,31 (1,01-1,70) respectivement. Pour la mortalité en MCV, le quartile le plus bas a montré un risque significativement accru (HR 1,94, IC à 95%: 1,29-2,90), mais le quartile le plus élevé ne différait pas significativement de la référence, avec HR 1,14 (0,73-1,77). L'analyse RCS a indiqué une relation non linéaire en forme de U entre les niveaux d'HbA1c et la mortalité toutes causes de causes (p = 0,026 pour la non-linéarité) et une relation non linéaire en J avec la mortalité CVD (P = 0,035 pour la non-linéarité). Cette étude de cohorte suggère que les niveaux d'HbA1c faibles et élevés sont associés à un risque accru de mortalité toutes causes confondues chez les patients âgés atteints de l'IRC non diabétique."
"ACUTE KIDNEY INJURY PRECIPITATED BY HAFF DISEASE IN A 28-YEAR-OLD NIGERIAN MALE ""CASE REPORT"".","Haff disease is defined as unexplained rhabdomyolysis following ingestion of some sea fish and crayfish. First reported in 1926 from the Baltic region, its pathophysiologic mechanism is largely unknown, but toxins release have been implicated. Common features include generalized myalgia, brown/ dark urine, elevated serum creatine kinase and creatinine, kidney dysfunction can be severe enough to cause acute kidney injury (AKI). We present the case of a 28-year-old man who ate cooked freshwater fish and initially presented with diffuse myalgia, headache and brown-colored urine, and later fever and diarrhea. He had severely elevated serum creatine kinase and creatinine, and was managed as a case of Haff disease related AKI (HDRAKI) complicated by sepsis. He had haemodialysis and antibiotics, and recovered kidney function. A detailed history of recent diet and occupational exposure is essential in the diagnosis and management of HDR-AKI. Dialysis could be life-saving.","La maladie HAFF est définie comme une rhabdomyolyse inexpliquée après l'ingestion de certains poissons de mer et écrevisses. Rapporté pour la première fois en 1926 de la région de la Baltique, son mécanisme physiopathologique est largement inconnu, mais la libération des toxines a été impliquée. Les caractéristiques communes incluent la myalgie généralisée, l'urine brune / foncée, la créatine sérique élevée et la créatinine, le dysfonctionnement rénal peut être suffisamment grave pour provoquer une lésion rénale aiguë (AKI). Nous présentons le cas d'un homme de 28 ans qui a mangé du poisson d'eau douce cuit et a initialement présenté une myalgie diffuse, des maux de tête et de l'urine de couleur brune, de plus en plus de fièvre et de diarrhée. Il avait gravement élevé la créatine kinase sérique et la créatinine, et a été géré comme un cas d'Aki (Hdraki) lié à la maladie HAFF compliquée par une septicémie. Il avait l'hémodialyse et les antibiotiques et a récupéré une fonction rénale. Une histoire détaillée de régime alimentaire récent et d'exposition professionnelle est essentielle dans le diagnostic et la gestion de HDR-AKI. La dialyse pourrait sauver des vies."
Respiratory Diphtheria in a 16-Year-Old Who Developed Multiple Life-Threatening Complications.,"Diphtheria is a contagious disease with high mortality. Although the global prevalence has been decreasing, the immigration of certain populations with suboptimal vaccination coverage has contributed to its resurgence in developed countries. We report a 16-year-old Afghan male with acute respiratory distress and life-threatening complications, including fulminant myocarditis with cardiac arrhythmias and neurologic complications. This case highlights the significance of optimal vaccination coverage, especially the vaccination status of migrants. This paper serves as a reminder of diphtheria's systemic impact and underscores the need for a multidisciplinary approach to respiratory diphtheria management. Vigilant monitoring, prompt immunoglobulin and antibiotic administration, and supportive care all play pivotal roles in enhancing patient outcomes and reducing mortality risks.","La diphtérie est une maladie contagieuse avec une mortalité élevée. Bien que la prévalence mondiale ait diminué, l'immigration de certaines populations ayant une couverture de vaccination sous-optimale a contribué à sa résurgence dans les pays développés. Nous rapportons un homme afghan de 16 ans souffrant de détresse respiratoire aiguë et de complications mortelles, notamment une myocardite fulminante avec des arythmies cardiaques et des complications neurologiques. Ce cas met en évidence l'importance de la couverture optimale de la vaccination, en particulier le statut de vaccination des migrants. Cet article rappelle l'impact systémique de la diphtérie et souligne la nécessité d'une approche multidisciplinaire de la gestion respiratoire de la diphtérie. La surveillance vigilante, l'immunoglobuline et l'administration antibiotiques rapides, et les soins de soutien jouent tous des rôles pivots dans l'amélioration des résultats des patients et la réduction des risques de mortalité."
Editorial: Unraveling the molecular mechanisms of cytokine signaling in regulating inflammatory diseases.,,
Advancing risk stratification in kidney transplantation: integrating HLA-derived T-cell epitope and B-cell epitope matching algorithms for enhanced predictive accuracy of HLA compatibility.,"The immune-mediated rejection of transplanted organs is a complex interplay between T cells and B cells, where the recognition of HLA-derived epitopes plays a crucial role. Several algorithms of molecular compatibility have been suggested, each focusing on a specific aspect of epitope immunogenicity. Considering reported death-censored graft survival in the SRTR dataset, we evaluated four models of molecular compatibility: antibody-verified Eplets, Snow, PIRCHE-II and amino acid matching. We have statistically evaluated their co-dependency and synergistic effects between models systematically on 400,935 kidney transplantations using Cox proportional hazards and XGBoost models. Multivariable models of histocompatibility generally outperformed univariable predictors, with a combined model of HLA-A, -B, -DR matching, Snow and PIRCHE-II yielding highest AUC in XGBoost and lowest BIC in Cox models. Augmentation of a clinical prediction model of pre-transplant parameters by molecular compatibility metrics improved model performance particularly considering long-term outcomes. Our study demonstrates that the use of multiple specialized molecular HLA matching predictors improves prediction performance, thereby improving risk classification and supporting informed decision-making in kidney transplantation.","Le rejet à médiation immunitaire des organes transplantés est une interaction complexe entre les cellules T et les cellules B, où la reconnaissance des épitopes dérivés de HLA joue un rôle crucial. Plusieurs algorithmes de compatibilité moléculaire ont été suggérés, chacun se concentrant sur un aspect spécifique de l'immunogénicité des épitopes. Compte tenu de la survie des greffes à la mort de la mort dans l'ensemble de données SRTR, nous avons évalué quatre modèles de compatibilité moléculaire: EPLETS vérifiés par anticorps, neige, pirche-II et correspondance des acides aminés. Nous avons évalué statistiquement leur co-dépendance et leurs effets synergiques entre les modèles systématiquement sur 400 935 transplantations rénales en utilisant des risques proportionnels COX et des modèles XGBOost. Des modèles multivariables d'histocompatibilité ont généralement surpassé les prédicteurs univariables, avec un modèle combiné de HLA-A, -B, -DR, neige, neige et pirche-II, donnant la plus élevée ASC en XGBOost et BIC les plus bas dans les modèles COX. L'augmentation d'un modèle de prédiction clinique des paramètres pré-transplantation par les métriques de compatibilité moléculaire a amélioré les performances du modèle, en particulier en considérant les résultats à long terme. Notre étude démontre que l'utilisation de multiples prédicteurs de correspondance moléculaire spécialisée HLA améliore les performances de prédiction, améliorant ainsi la classification des risques et soutenant la prise de décision éclairée dans la transplantation rénale."
